{
  "id": "oddly_smooth_stone",
  "name": "Oddly Smooth Stone",
  "tier": "common",
  "pool": "combat",
  "description": "At the start of each combat, gain 1 Dexterity.",
  "source": "authored",
  "hooks": [
    { "trigger": "combat_start", "effects": [ { "op": "apply_status", "status": "dexterity", "amount": 1 } ] }
  ]
}
